{
  "schema_version": "1.0.0",
  "witness_id": "nmlt-expected-counterexample-v1:sha256:18482ff41318611ea9dad3b239680d3026876be6d59bf7cd6380dc7bd9e1bb06",
  "status": "expected_not_observed",
  "case_id": "response-binding",
  "property_id": "nmlt-benchmark-property-v1:sha256:15a3427faba0a4cf568c7bb01b98cf5ff750430d605d20c04dc8df80e7c64eb0",
  "minimal_transition_count": 1,
  "initial_observation": {
    "phase": "dispatched_phase",
    "response_intact": false
  },
  "steps": [
    {
      "action": "evaluate",
      "resulting_observation": {
        "phase": "evaluated",
        "response_intact": false
      }
    }
  ],
  "violation": {
    "state_index": 1,
    "predicate": "evaluated implies response_intact",
    "explanation": "Evaluation completes with no intact response binding."
  },
  "normalization": {
    "state_field_order": ["phase", "response_intact"],
    "transition_tie_break": "lexicographic action name then canonical state bytes"
  }
}
